{
  "$schema": "https://opencompliancefoundation.com/specs/schemas/release-attestation.schema.json",
  "attestationId": "opencompliance-verifier-0.9.3-attestation",
  "generatedAt": "2026-03-27T06:01:45Z",
  "releaseId": "opencompliance-verifier-0.9.3",
  "verifierVersion": "opencompliance-verifier/0.9.3",
  "attestationScope": "portable_bundle_self_replay",
  "witness": {
    "witnessId": "oc-synthetic-release-witness",
    "witnessType": "independent_witness",
    "witnessRole": "independent_replay_witness",
    "trustPolicyId": "oc.trust.independent-witness"
  },
  "checks": [
    {
      "name": "replay minimal corridor from bundled verifier",
      "command": [
        "/home/codespace/.python/current/bin/python3",
        "scripts/verify_fixture.py",
        "--fixture-root",
        "fixtures/public/minimal",
        "--check"
      ],
      "description": "Replays the blocked minimal corridor directly from the shipped bundle.",
      "status": "verified",
      "summary": "check passed"
    },
    {
      "name": "replay issued corridor from bundled verifier",
      "command": [
        "/home/codespace/.python/current/bin/python3",
        "scripts/verify_fixture.py",
        "--fixture-root",
        "fixtures/public/issued",
        "--check"
      ],
      "description": "Replays the issued mixed corridor directly from the shipped bundle.",
      "status": "verified",
      "summary": "check passed"
    },
    {
      "name": "validate bundled public examples",
      "command": [
        "/home/codespace/.python/current/bin/python3",
        "conformance/scripts/validate_public_examples.py",
        "--fixture",
        "all"
      ],
      "description": "Runs the bundled public-example conformance validator against all shipped synthetic corridors.",
      "status": "verified",
      "summary": "fixtures=ai-governance,cyber-baseline,failed,issued,medium,minimal,stale"
    },
    {
      "name": "verify minimal transparency log",
      "command": [
        "/home/codespace/.python/current/bin/python3",
        "scripts/verify_transparency_log.py",
        "--log",
        "fixtures/public/minimal/transparency-log.json",
        "--proofs",
        "fixtures/public/minimal/inclusion-proofs.json"
      ],
      "description": "Checks append-only integrity for the minimal bundled corridor.",
      "status": "verified",
      "summary": "validated transparency log for bundle exampleco-minimal-bundle-2026-03-24"
    },
    {
      "name": "verify issued transparency log",
      "command": [
        "/home/codespace/.python/current/bin/python3",
        "scripts/verify_transparency_log.py",
        "--log",
        "fixtures/public/issued/transparency-log.json",
        "--proofs",
        "fixtures/public/issued/inclusion-proofs.json"
      ],
      "description": "Checks append-only integrity for the issued bundled corridor.",
      "status": "verified",
      "summary": "validated transparency log for bundle exampleco-issued-bundle-2026-03-24"
    }
  ],
  "note": "Synthetic release attestation for the public verifier bundle. This proves bundle self-replay and transparency verification from the shipped bundle; it does not claim live CI provenance or production runner identity."
}
